{
  "confidence": 1.0,
  "created_at": "2026-08-12T12:00:00Z",
  "edge_id": "edg_01J00000000000000000000001",
  "edge_type": "CALLS",
  "evidence_grade": "lead",
  "evidence_refs": [
    "evd_01J00000000000000000000001"
  ],
  "integrity": {
    "algorithm": "sha256",
    "canonicalization": "rfc8785",
    "content_hash": "sha256:a2f3a7040bf97333eea89424efc97e9815f2c9fc8db9feaca892c57e50c57dc1",
    "excluded_fields": [
      "integrity.content_hash"
    ]
  },
  "namespace": "target",
  "properties": [
    {
      "name": "dispatch",
      "value": "external",
      "value_type": "string"
    }
  ],
  "provenance": [
    {
      "license_or_terms": "private-test-fixture",
      "provenance_id": "prv_01J00000000000000000000001",
      "raw_hash": "sha256:bbbbbbbbbbbbbbbbbbbbbbbbbbbbbbbbbbbbbbbbbbbbbbbbbbbbbbbbbbbbbbbb",
      "retrieved_at": "2026-08-12T12:00:00Z",
      "source_uri": "https://fixtures.ayran.dev/m0",
      "source_version": "fixture-v1",
      "transformation_lineage": []
    }
  ],
  "revision": 1,
  "run_id": "run_01J00000000000000000000001",
  "schema_version": "1.0.0",
  "source_id": "nod_01J00000000000000000000001",
  "source_locator": "target/src/Vault.sol:10",
  "status": "active",
  "target_id": "nod_01J00000000000000000000002",
  "trust_class": "deterministic_tool",
  "valid_from_event": "evt_01J00000000000000000000001",
  "valid_to_event": null
}
